smartctl 7.4 2023-08-01 r5530 [x86_64-linux-6.12.90+deb13-amd64] (local build)
Copyright (C) 2002-23, Bruce Allen, Christian Franke, www.smartmontools.org

=== START OF READ SMART DATA SECTION ===
SMART overall-health self-assessment test result: PASSED

SMART Attributes Data Structure revision number: 10
Vendor Specific SMART Attributes with Thresholds:
ID# ATTRIBUTE_NAME          FLAG     VALUE WORST THRESH TYPE      UPDATED  WHEN_FAILED RAW_VALUE
  1 Raw_Read_Error_Rate     0x000f   075   064   044    Pre-fail  Always       -       227531687
  3 Spin_Up_Time            0x0003   082   080   000    Pre-fail  Always       -       0
  4 Start_Stop_Count        0x0032   100   100   020    Old_age   Always       -       111
  5 Reallocated_Sector_Ct   0x0033   100   100   010    Pre-fail  Always       -       0
  7 Seek_Error_Rate         0x000f   077   060   045    Pre-fail  Always       -       52830264
  9 Power_On_Hours          0x0032   099   099   000    Old_age   Always       -       1346
 10 Spin_Retry_Count        0x0013   100   100   097    Pre-fail  Always       -       0
 12 Power_Cycle_Count       0x0032   100   100   020    Old_age   Always       -       100
 18 Unknown_Attribute       0x000b   100   100   050    Pre-fail  Always       -       0
187 Reported_Uncorrect      0x0032   095   095   000    Old_age   Always       -       5
188 Command_Timeout         0x0032   100   096   000    Old_age   Always       -       42950328330
190 Airflow_Temperature_Cel 0x0022   064   045   040    Old_age   Always       -       36 (Min/Max 23/43)
192 Power-Off_Retract_Count 0x0032   100   100   000    Old_age   Always       -       17
193 Load_Cycle_Count        0x0032   100   100   000    Old_age   Always       -       250
194 Temperature_Celsius     0x0022   036   055   000    Old_age   Always       -       36 (0 19 0 0 0)
195 Hardware_ECC_Recovered  0x001a   084   064   000    Old_age   Always       -       227531687
197 Current_Pending_Sector  0x0012   100   100   000    Old_age   Always       -       8
198 Offline_Uncorrectable   0x0010   100   100   000    Old_age   Offline      -       8
199 UDMA_CRC_Error_Count    0x003e   200   200   000    Old_age   Always       -       0
240 Head_Flying_Hours       0x0000   100   253   000    Old_age   Offline      -       1254 (170 102 0)
241 Total_LBAs_Written      0x0000   100   253   000    Old_age   Offline      -       13415006982
242 Total_LBAs_Read         0x0000   100   253   000    Old_age   Offline      -       240274028


smartctl 7.4 2023-08-01 r5530 [x86_64-linux-6.12.90+deb13-amd64] (local build)
Copyright (C) 2002-23, Bruce Allen, Christian Franke, www.smartmontools.org

=== START OF INFORMATION SECTION ===
Device Model:     ST8000VE001-3CC101
Serial Number:    <serial>
LU WWN Device Id: <wwn>
Firmware Version: EV01
User Capacity:    8,001,563,222,016 bytes [8.00 TB]
Sector Sizes:     512 bytes logical, 4096 bytes physical
Rotation Rate:    7200 rpm
Form Factor:      3.5 inches
Device is:        Not in smartctl database 7.3/5528
ATA Version is:   ACS-4 (minor revision not indicated)
SATA Version is:  SATA 3.3, 6.0 Gb/s (current: 6.0 Gb/s)
Local Time is:    Mon Sep 28 15:13:56 2026 CEST
SMART support is: Available - device has SMART capability.
SMART support is: Enabled
AAM feature is:   Unavailable
APM feature is:   Unavailable
Rd look-ahead is: Enabled
Write cache is:   Enabled
DSN feature is:   Disabled
ATA Security is:  Disabled, NOT FROZEN [SEC1]
Write SCT (Get) Feature Control Command failed: scsi error aborted command
Wt Cache Reorder: Unknown (SCT Feature Control command failed)

Read SMART Data failed: SAT command failed

=== START OF READ SMART DATA SECTION ===
SMART overall-health self-assessment test result: PASSED

General Purpose Log Directory Version 1
SMART           Log Directory Version 1 [multi-sector log support]
Address    Access  R/W   Size  Description
0x00       GPL,SL  R/O      1  Log Directory
0x01           SL  R/O      1  Summary SMART error log
0x02           SL  R/O      5  Comprehensive SMART error log
0x03       GPL     R/O      5  Ext. Comprehensive SMART error log
0x04       GPL     R/O    256  Device Statistics log
0x04       SL      R/O      8  Device Statistics log
0x06           SL  R/O      1  SMART self-test log
0x07       GPL     R/O      1  Extended self-test log
0x08       GPL     R/O      2  Power Conditions log
0x09           SL  R/W      1  Selective self-test log
0x0a       GPL     R/W      8  Device Statistics Notification
0x0c       GPL     R/O   2048  Pending Defects log
0x10       GPL     R/O      1  NCQ Command Error log
0x11       GPL     R/O      1  SATA Phy Event Counters log
0x13       GPL     R/O      1  SATA NCQ Send and Receive log
0x15       GPL     R/W      1  Rebuild Assist log
0x21       GPL     R/O      1  Write stream error log
0x22       GPL     R/O      1  Read stream error log
0x24       GPL     R/O    768  Current Device Internal Status Data log
0x2f       GPL     R/O      1  Set Sector Configuration
0x30       GPL,SL  R/O      9  IDENTIFY DEVICE data log
0x80-0x9f  GPL,SL  R/W     16  Host vendor specific log
0xa1       GPL,SL  VS      24  Device vendor specific log
0xa2       GPL     VS   16320  Device vendor specific log
0xa4       GPL,SL  VS     160  Device vendor specific log
0xa6       GPL     VS     192  Device vendor specific log
0xa8-0xa9  GPL,SL  VS     136  Device vendor specific log
0xab       GPL     VS       1  Device vendor specific log
0xad       GPL     VS      16  Device vendor specific log
0xb6       GPL     VS    1920  Device vendor specific log
0xbe-0xbf  GPL     VS   65535  Device vendor specific log
0xc1       GPL,SL  VS       8  Device vendor specific log
0xc3       GPL,SL  VS      32  Device vendor specific log
0xc9       GPL,SL  VS       8  Device vendor specific log
0xca       GPL,SL  VS      16  Device vendor specific log
0xcd       GPL,SL  VS       8  Device vendor specific log
0xd1       GPL     VS     336  Device vendor specific log
0xd2       GPL     VS   10000  Device vendor specific log
0xd4       GPL     VS    2048  Device vendor specific log
0xda       GPL,SL  VS       1  Device vendor specific log
0xe0       GPL,SL  R/W      1  SCT Command/Status
0xe1       GPL,SL  R/W      1  SCT Data Transfer

SMART Extended Comprehensive Error Log Version: 1 (5 sectors)
Device Error Count: 5
	CR     = Command Register
	FEATR  = Features Register
	COUNT  = Count (was: Sector Count) Register
	LBA_48 = Upper bytes of LBA High/Mid/Low Registers ]  ATA-8
	LH     = LBA High (was: Cylinder High) Register    ]   LBA
	LM     = LBA Mid (was: Cylinder Low) Register      ] Register
	LL     = LBA Low (was: Sector Number) Register     ]
	DV     = Device (was: Device/Head) Register
	DC     = Device Control Register
	ER     = Error register
	ST     = Status register
Powered_Up_Time is measured from power on, and printed as
DDd+hh:mm:SS.sss where DD=days, hh=hours, mm=minutes,
SS=sec, and sss=millisec. It "wraps" after 49.710 days.

Error 5 [4] occurred at disk power-on lifetime: 1346 hours (56 days + 2 hours)
  When the command that caused the error occurred, the device was active or idle.

  After command completion occurred, registers were:
  ER -- ST COUNT  LBA_48  LH LM LL DV DC
  -- -- -- == -- == == == -- -- -- -- --
  40 -- 51 00 00 00 00 0c 51 3b b0 00 00  Error: UNC at LBA = 0x0c513bb0 = 206650288

  Commands leading to the command that caused the error were:
  CR FEATR COUNT  LBA_48  LH LM LL DV DC  Powered_Up_Time  Command/Feature_Name
  -- == -- == -- == == == -- -- -- -- --  ---------------  --------------------
  25 00 03 00 01 00 00 0c 51 3b b0 40 00  2d+21:57:17.848  READ DMA EXT
  ef 00 03 00 46 00 00 00 51 3b b0 00 00  2d+21:57:17.847  SET FEATURES [Set transfer mode]
  ef 00 03 00 0c 00 00 00 51 3b b0 00 00  2d+21:57:17.847  SET FEATURES [Set transfer mode]
  ec 00 03 00 01 00 00 00 51 3b b0 00 00  2d+21:57:17.763  IDENTIFY DEVICE
  00 00 00 00 00 00 00 00 00 00 00 00 04  2d+21:57:17.633  NOP [Abort queued commands]

Error 4 [3] occurred at disk power-on lifetime: 1346 hours (56 days + 2 hours)
  When the command that caused the error occurred, the device was active or idle.

  After command completion occurred, registers were:
  ER -- ST COUNT  LBA_48  LH LM LL DV DC
  -- -- -- == -- == == == -- -- -- -- --
  40 -- 51 00 00 00 00 0c 51 3b b0 00 00  Error: UNC at LBA = 0x0c513bb0 = 206650288

  Commands leading to the command that caused the error were:
  CR FEATR COUNT  LBA_48  LH LM LL DV DC  Powered_Up_Time  Command/Feature_Name
  -- == -- == -- == == == -- -- -- -- --  ---------------  --------------------
  25 00 03 00 01 00 00 0c 51 3b b0 40 00  2d+21:57:14.451  READ DMA EXT
  ef 00 03 00 46 00 00 00 51 3b b0 00 00  2d+21:57:14.451  SET FEATURES [Set transfer mode]
  ef 00 03 00 0c 00 00 00 51 3b b0 00 00  2d+21:57:14.451  SET FEATURES [Set transfer mode]
  ec 00 03 00 01 00 00 00 51 3b b0 00 00  2d+21:57:14.449  IDENTIFY DEVICE
  00 00 00 00 00 00 00 00 00 00 00 00 04  2d+21:57:14.246  NOP [Abort queued commands]

Error 3 [2] occurred at disk power-on lifetime: 1346 hours (56 days + 2 hours)
  When the command that caused the error occurred, the device was active or idle.

  After command completion occurred, registers were:
  ER -- ST COUNT  LBA_48  LH LM LL DV DC
  -- -- -- == -- == == == -- -- -- -- --
  40 -- 51 00 00 00 00 0c 51 3b b0 00 00  Error: UNC at LBA = 0x0c513bb0 = 206650288

  Commands leading to the command that caused the error were:
  CR FEATR COUNT  LBA_48  LH LM LL DV DC  Powered_Up_Time  Command/Feature_Name
  -- == -- == -- == == == -- -- -- -- --  ---------------  --------------------
  25 00 03 00 01 00 00 0c 51 3b b0 40 00  2d+21:57:10.542  READ DMA EXT
  ef 00 03 00 46 00 00 00 51 3b b0 00 00  2d+21:57:10.541  SET FEATURES [Set transfer mode]
  ef 00 03 00 0c 00 00 00 51 3b b0 00 00  2d+21:57:10.541  SET FEATURES [Set transfer mode]
  ec 00 03 00 01 00 00 00 51 3b b0 00 00  2d+21:57:10.423  IDENTIFY DEVICE
  00 00 00 00 00 00 00 00 00 00 00 00 04  2d+21:57:10.301  NOP [Abort queued commands]

Error 2 [1] occurred at disk power-on lifetime: 1346 hours (56 days + 2 hours)
  When the command that caused the error occurred, the device was active or idle.

  After command completion occurred, registers were:
  ER -- ST COUNT  LBA_48  LH LM LL DV DC
  -- -- -- == -- == == == -- -- -- -- --
  40 -- 51 00 00 00 00 0c 51 3b b0 00 00  Error: UNC at LBA = 0x0c513bb0 = 206650288

  Commands leading to the command that caused the error were:
  CR FEATR COUNT  LBA_48  LH LM LL DV DC  Powered_Up_Time  Command/Feature_Name
  -- == -- == -- == == == -- -- -- -- --  ---------------  --------------------
  25 00 03 00 01 00 00 0c 51 3b b0 40 00  2d+21:57:06.857  READ DMA EXT
  ef 00 03 00 46 00 00 00 00 a0 a6 00 00  2d+21:57:06.857  SET FEATURES [Set transfer mode]
  ef 00 03 00 0c 00 00 00 00 a0 a6 00 00  2d+21:57:06.856  SET FEATURES [Set transfer mode]
  ec 00 00 00 12 00 00 00 00 a0 a6 00 00  2d+21:57:06.725  IDENTIFY DEVICE
  00 00 00 00 00 00 00 00 00 00 00 00 04  2d+21:57:06.635  NOP [Abort queued commands]

Error 1 [0] occurred at disk power-on lifetime: 1346 hours (56 days + 2 hours)
  When the command that caused the error occurred, the device was active or idle.

  After command completion occurred, registers were:
  ER -- ST COUNT  LBA_48  LH LM LL DV DC
  -- -- -- == -- == == == -- -- -- -- --
  40 -- 51 00 00 00 00 0c 51 3b b0 00 00  Error: UNC at LBA = 0x0c513bb0 = 206650288

  Commands leading to the command that caused the error were:
  CR FEATR COUNT  LBA_48  LH LM LL DV DC  Powered_Up_Time  Command/Feature_Name
  -- == -- == -- == == == -- -- -- -- --  ---------------  --------------------
  60 00 00 00 01 00 00 0c 51 3b b0 40 00  2d+21:57:02.934  READ FPDMA QUEUED
  2f 00 00 00 12 00 00 00 00 a0 a6 00 00  2d+21:56:55.956  READ LOG EXT
  2f 00 00 00 01 00 00 00 00 80 a6 00 00  2d+21:56:55.914  READ LOG EXT
  2f 00 00 00 02 00 00 00 00 60 a6 00 00  2d+21:56:55.873  READ LOG EXT
  2f 00 00 00 01 00 00 00 00 40 a6 00 00  2d+21:56:55.831  READ LOG EXT

SMART Extended Self-test Log Version: 1 (1 sectors)
Num  Test_Description    Status                  Remaining  LifeTime(hours)  LBA_of_first_error
# 1  Extended offline    Completed: read failure       90%      1340         206650288
# 2  Extended offline    Aborted by host               90%      1340         -
# 3  Short offline       Completed without error       00%      1340         -

SMART Selective self-test log data structure revision number 1
 SPAN  MIN_LBA  MAX_LBA  CURRENT_TEST_STATUS
    1        0        0  Not_testing
    2        0        0  Not_testing
    3        0        0  Not_testing
    4        0        0  Not_testing
    5        0        0  Not_testing
Selective self-test flags (0x0):
  After scanning selected spans, do NOT read-scan remainder of disk.
If Selective self-test is pending on power-up, resume after 0 minute delay.

SCT Status Version:                  3
SCT Version (vendor specific):       522 (0x020a)
Device State:                        Active (0)
Current Temperature:                    36 Celsius
Power Cycle Min/Max Temperature:     23/43 Celsius
Lifetime    Min/Max Temperature:     19/55 Celsius
Under/Over Temperature Limit Count:   0/70
SMART Status:                        0xc24f (PASSED)
Vendor specific:
00 00 00 00 00 00 00 00 00 00 00 00 00 00 00 00
00 00 00 00 03 00 00 00 00 00 00 00 00 00 00 00

SCT Temperature History Version:     2
Temperature Sampling Period:         3 minutes
Temperature Logging Interval:        59 minutes
Min/Max recommended Temperature:     10/25 Celsius
Min/Max Temperature Limit:            5/70 Celsius
Temperature History Size (Index):    128 (120)

Index    Estimated Time   Temperature Celsius
 121    2026-09-23 09:48    33  **************
 122    2026-09-23 10:47    38  *******************
 123    2026-09-23 11:46     ?  -
 124    2026-09-23 12:45    26  *******
 125    2026-09-23 13:44     ?  -
 126    2026-09-23 14:43    27  ********
 127    2026-09-23 15:42     ?  -
   0    2026-09-23 16:41    26  *******
   1    2026-09-23 17:40     ?  -
   2    2026-09-23 18:39    25  ******
   3    2026-09-23 19:38     ?  -
   4    2026-09-23 20:37    26  *******
   5    2026-09-23 21:36     ?  -
   6    2026-09-23 22:35    29  **********
   7    2026-09-23 23:34     ?  -
   8    2026-09-24 00:33    32  *************
   9    2026-09-24 01:32    37  ******************
  10    2026-09-24 02:31     ?  -
  11    2026-09-24 03:30    22  ***
  12    2026-09-24 04:29     ?  -
  13    2026-09-24 05:28    22  ***
  14    2026-09-24 06:27    35  ****************
  15    2026-09-24 07:26     ?  -
  16    2026-09-24 08:25    35  ****************
  17    2026-09-24 09:24     ?  -
  18    2026-09-24 10:23    36  *****************
  19    2026-09-24 11:22     ?  -
  20    2026-09-24 12:21    23  ****
  21    2026-09-24 13:20     ?  -
  22    2026-09-24 14:19    24  *****
  23    2026-09-24 15:18     ?  -
  24    2026-09-24 16:17    25  ******
  25    2026-09-24 17:16     ?  -
  26    2026-09-24 18:15    25  ******
  27    2026-09-24 19:14     ?  -
  28    2026-09-24 20:13    25  ******
  29    2026-09-24 21:12     ?  -
  30    2026-09-24 22:11    24  *****
  31    2026-09-24 23:10     ?  -
  32    2026-09-25 00:09    25  ******
  33    2026-09-25 01:08     ?  -
  34    2026-09-25 02:07    21  **
  35    2026-09-25 03:06     ?  -
  36    2026-09-25 04:05    21  **
  37    2026-09-25 05:04     ?  -
  38    2026-09-25 06:03    23  ****
  39    2026-09-25 07:02     ?  -
  40    2026-09-25 08:01    23  ****
  41    2026-09-25 09:00     ?  -
  42    2026-09-25 09:59    21  **
  43    2026-09-25 10:58     ?  -
  44    2026-09-25 11:57    22  ***
  45    2026-09-25 12:56     ?  -
  46    2026-09-25 13:55    22  ***
  47    2026-09-25 14:54     ?  -
  48    2026-09-25 15:53    20  *
  49    2026-09-25 16:52     ?  -
  50    2026-09-25 17:51    23  ****
  51    2026-09-25 18:50    28  *********
 ...    ..(  6 skipped).    ..  *********
  58    2026-09-26 01:43    28  *********
  59    2026-09-26 02:42    27  ********
 ...    ..( 14 skipped).    ..  ********
  74    2026-09-26 17:27    27  ********
  75    2026-09-26 18:26    28  *********
  76    2026-09-26 19:25    28  *********
  77    2026-09-26 20:24    28  *********
  78    2026-09-26 21:23    27  ********
 ...    ..( 19 skipped).    ..  ********
  98    2026-09-27 17:03    27  ********
  99    2026-09-27 18:02    41  **********************
 100    2026-09-27 19:01    43  ************************
 ...    ..(  4 skipped).    ..  ************************
 105    2026-09-27 23:56    43  ************************
 106    2026-09-28 00:55    28  *********
 107    2026-09-28 01:54    26  *******
 ...    ..(  6 skipped).    ..  *******
 114    2026-09-28 08:47    26  *******
 115    2026-09-28 09:46    41  **********************
 116    2026-09-28 10:45    40  *********************
 117    2026-09-28 11:44    40  *********************
 118    2026-09-28 12:43    42  ***********************
 119    2026-09-28 13:42    42  ***********************
 120    2026-09-28 14:41    38  *******************

SCT Error Recovery Control:
           Read:     70 (7.0 seconds)
          Write:     70 (7.0 seconds)

Device Statistics (GP Log 0x04)
Page  Offset Size        Value Flags Description
0x01  =====  =               =  ===  == General Statistics (rev 1) ==
0x01  0x008  4             100  ---  Lifetime Power-On Resets
0x01  0x010  4            1346  ---  Power-on Hours
0x01  0x018  6     13414077575  ---  Logical Sectors Written
0x01  0x020  6        33811076  ---  Number of Write Commands
0x01  0x028  6       238968469  ---  Logical Sectors Read
0x01  0x030  6         2156182  ---  Number of Read Commands
0x01  0x038  6               -  ---  Date and Time TimeStamp
0x03  =====  =               =  ===  == Rotating Media Statistics (rev 1) ==
0x03  0x008  4            1273  ---  Spindle Motor Power-on Hours
0x03  0x010  4            1262  ---  Head Flying Hours
0x03  0x018  4             250  ---  Head Load Events
0x03  0x020  4               0  ---  Number of Reallocated Logical Sectors
0x03  0x028  4               8  ---  Read Recovery Attempts
0x03  0x030  4               0  ---  Number of Mechanical Start Failures
0x03  0x038  4               8  ---  Number of Realloc. Candidate Logical Sectors
0x03  0x040  4              17  ---  Number of High Priority Unload Events
0x04  =====  =               =  ===  == General Errors Statistics (rev 1) ==
0x04  0x008  4               8  ---  Number of Reported Uncorrectable Errors
0x04  0x010  4               3  ---  Resets Between Cmd Acceptance and Completion
0x05  =====  =               =  ===  == Temperature Statistics (rev 1) ==
0x05  0x008  1              36  ---  Current Temperature
0x05  0x010  1              32  ---  Average Short Term Temperature
0x05  0x018  1              50  ---  Average Long Term Temperature
0x05  0x020  1              55  ---  Highest Temperature
0x05  0x028  1              23  ---  Lowest Temperature
0x05  0x030  1              54  ---  Highest Average Short Term Temperature
0x05  0x038  1              27  ---  Lowest Average Short Term Temperature
0x05  0x040  1              52  ---  Highest Average Long Term Temperature
0x05  0x048  1              50  ---  Lowest Average Long Term Temperature
0x05  0x050  4               0  ---  Time in Over-Temperature
0x05  0x058  1              70  ---  Specified Maximum Operating Temperature
0x05  0x060  4               0  ---  Time in Under-Temperature
0x05  0x068  1               5  ---  Specified Minimum Operating Temperature
0x06  =====  =               =  ===  == Transport Statistics (rev 1) ==
0x06  0x008  4              93  ---  Number of Hardware Resets
0x06  0x010  4               9  ---  Number of ASR Events
0x06  0x018  4               0  ---  Number of Interface CRC Errors
0xff  =====  =               =  ===  == Vendor Specific Statistics (rev 1) ==
0xff  0x010  7               0  ---  Vendor Specific
0xff  0x018  7               0  ---  Vendor Specific
                                |||_ C monitored condition met
                                ||__ D supports DSN
                                |___ N normalized value

Pending Defects log (GP Log 0x0c)
Index                LBA    Hours
    0          206650288     1340
    1          206650289     1340
    2          206650290     1340
    3          206650291     1340
    4          206650292     1340
    5          206650293     1340
    6          206650294     1340
    7          206650295     1340

SATA Phy Event Counters (GP Log 0x11)
ID      Size     Value  Description
0x000a  2            1  Device-to-host register FISes sent due to a COMRESET
0x0001  2            0  Command failed due to ICRC error
0x0003  2            0  R_ERR response for device-to-host data FIS
0x0004  2            0  R_ERR response for host-to-device data FIS
0x0006  2            0  R_ERR response for device-to-host non-data FIS
0x0007  2            0  R_ERR response for host-to-device non-data FIS

Seagate FARM log (GP Log 0xa6) supported [try: -l farm]

smartctl 7.4 2023-08-01 r5530 [x86_64-linux-6.12.90+deb13-amd64] (local build)
Copyright (C) 2002-23, Bruce Allen, Christian Franke, www.smartmontools.org

Seagate Field Access Reliability Metrics log (FARM) (GP Log 0xa6)
	FARM Log Page 0: Log Header
		FARM Log Version: 2.9
		Pages Supported: 6
		Log Size: 98304
		Page Size: 16384
		Heads Supported: 24
		Number of Copies: 0
		Reason for Frame Capture: 0
	FARM Log Page 1: Drive Information
		Serial Number: <serial>
		World Wide Name: <wwn>
		Device Interface: SATA
		Device Capacity in Sectors: 15628053168
		Physical Sector Size: 4096
		Logical Sector Size: 512
		Device Buffer Size: 268435456
		Number of Heads: 10
		Device Form Factor: 3.5 inches
		Rotation Rate: 7200 rpm
		Firmware Rev: EV01    
		ATA Security State (ID Word 128): 0x01621
		ATA Features Supported (ID Word 78): 0x0168cc
		ATA Features Enabled (ID Word 79): 0x0000000000000040
		Power on Hours: 1346
		Spindle Power on Hours: 1273
		Head Flight Hours: 1262
		Head Load Events: 250
		Power Cycle Count: 101
		Hardware Reset Count: 93
		Spin-up Time: 20 ms
		Time to ready of the last power cycle: 22553 ms
		Time drive is held in staggered spin: 0 ms
		Model Number: 
		Drive Recording Type: UNKNOWN
		Max Number of Available Sectors for Reassignment: 0
		Assembly Date (YYWW): 
		Depopulation Head Mask: 0
	FARM Log Page 2: Workload Statistics
		Total Number of Read Commands: 2163201
		Total Number of Write Commands: 33816640
		Total Number of Random Read Commands: 348638
		Total Number of Random Write Commands: 33793898
		Total Number Of Other Commands: 28689
		Logical Sectors Written: 13415006982
		Logical Sectors Read: 240273981
		Number of dither events during current power cycle: 0
		Number of times dither was held off during random workloads: 0
		Number of times dither was held off during sequential workloads: 0
		Number of Read commands from 0-3.125% of LBA space for last 3 SMART Summary Frames: 0
		Number of Read commands from 3.125-25% of LBA space for last 3 SMART Summary Frames: 0
		Number of Read commands from 25-75% of LBA space for last 3 SMART Summary Frames: 0
		Number of Read commands from 75-100% of LBA space for last 3 SMART Summary Frames: 0
		Number of Write commands from 0-3.125% of LBA space for last 3 SMART Summary Frames: 0
		Number of Write commands from 3.125-25% of LBA space for last 3 SMART Summary Frames: 0
		Number of Write commands from 25-75% of LBA space for last 3 SMART Summary Frames: 0
		Number of Write commands from 75-100% of LBA space for last 3 SMART Summary Frames: 0
	FARM Log Page 3: Error Statistics
		Unrecoverable Read Errors: 5
		Unrecoverable Write Errors: 0
		Number of Reallocated Sectors: 0
		Number of Read Recovery Attempts: 8
		Number of Mechanical Start Failures: 0
		Number of Reallocated Candidate Sectors: 8
		Number of ASR Events: 9
		Number of Interface CRC Errors: 0
		Spin Retry Count: 0
		Spin Retry Count Normalized: 100
		Spin Retry Count Worst: 100
		Number of IOEDC Errors (Raw): 0
		CTO Count Total: 10
		CTO Count Over 5s: 10
		CTO Count Over 7.5s: 10
		Total Flash LED (Assert) Events: 0
		Index of the last Flash LED: 0
		Flash LED Event 0:
			Event Information: 0x0000000000000000
			Timestamp of Event 0 (hours): 0
			Power Cycle Event 0: 0
		Flash LED Event 1:
			Event Information: 0x0000000000000000
			Timestamp of Event 1 (hours): 0
			Power Cycle Event 1: 0
		Flash LED Event 2:
			Event Information: 0x0000000000000000
			Timestamp of Event 2 (hours): 0
			Power Cycle Event 2: 0
		Flash LED Event 3:
			Event Information: 0x0000000000000000
			Timestamp of Event 3 (hours): 0
			Power Cycle Event 3: 0
		Flash LED Event 4:
			Event Information: 0x0000000000000000
			Timestamp of Event 4 (hours): 0
			Power Cycle Event 4: 0
		Flash LED Event 5:
			Event Information: 0x0000000000000000
			Timestamp of Event 5 (hours): 0
			Power Cycle Event 5: 0
		Flash LED Event 6:
			Event Information: 0x0000000000000000
			Timestamp of Event 6 (hours): 0
			Power Cycle Event 6: 0
		Flash LED Event 7:
			Event Information: 0x0000000000000000
			Timestamp of Event 7 (hours): 0
			Power Cycle Event 7: 0
		Uncorrectable errors: 5
		Cumulative Lifetime Unrecoverable Read errors due to ERC: 0
		Cum Lifetime Unrecoverable by head 0:
			Cumulative Lifetime Unrecoverable Read Repeating: 0
			Cumulative Lifetime Unrecoverable Read Unique: 0
		Cum Lifetime Unrecoverable by head 1:
			Cumulative Lifetime Unrecoverable Read Repeating: 0
			Cumulative Lifetime Unrecoverable Read Unique: 0
		Cum Lifetime Unrecoverable by head 2:
			Cumulative Lifetime Unrecoverable Read Repeating: 0
			Cumulative Lifetime Unrecoverable Read Unique: 0
		Cum Lifetime Unrecoverable by head 3:
			Cumulative Lifetime Unrecoverable Read Repeating: 0
			Cumulative Lifetime Unrecoverable Read Unique: 0
		Cum Lifetime Unrecoverable by head 4:
			Cumulative Lifetime Unrecoverable Read Repeating: 0
			Cumulative Lifetime Unrecoverable Read Unique: 0
		Cum Lifetime Unrecoverable by head 5:
			Cumulative Lifetime Unrecoverable Read Repeating: 0
			Cumulative Lifetime Unrecoverable Read Unique: 0
		Cum Lifetime Unrecoverable by head 6:
			Cumulative Lifetime Unrecoverable Read Repeating: 0
			Cumulative Lifetime Unrecoverable Read Unique: 0
		Cum Lifetime Unrecoverable by head 7:
			Cumulative Lifetime Unrecoverable Read Repeating: 0
			Cumulative Lifetime Unrecoverable Read Unique: 0
		Cum Lifetime Unrecoverable by head 8:
			Cumulative Lifetime Unrecoverable Read Repeating: 0
			Cumulative Lifetime Unrecoverable Read Unique: 0
		Cum Lifetime Unrecoverable by head 9:
			Cumulative Lifetime Unrecoverable Read Repeating: 0
			Cumulative Lifetime Unrecoverable Read Unique: 0
	FARM Log Page 4: Environment Statistics
		Current Temperature (Celsius): 36
		Highest Temperature: 55
		Lowest Temperature: 23
		Average Short Term Temperature: 32
		Average Long Term Temperature: 50
		Highest Average Short Term Temperature: 54
		Lowest Average Short Term Temperature: 27
		Highest Average Long Term Temperature: 52
		Lowest Average Long Term Temperature: 50
		Time In Over Temperature (minutes): 0
		Time In Under Temperature (minutes): 0
		Specified Max Operating Temperature: 70
		Specified Min Operating Temperature: 5
		Current Relative Humidity: 0
		Current Motor Power: 5392
		Current 12 volts: 0.000
		Minimum 12 volts: 0.000
		Maximum 12 volts: 0.000
		Current 5 volts: 0.000
		Minimum 5 volts: 0.000
		Maximum 5 volts: 0.000
		12V Power Average: 0.000
		12V Power Minimum: 0.000
		12V Power Maximum: 0.000
		5V Power Average: 0.000
		5V Power Minimum: 0.000
		5V Power Maximum: 0.000
	FARM Log Page 5: Reliability Statistics
		Error Rate (SMART Attribute 1 Raw): 0x000000000d8fdba7
		Error Rate (SMART Attribute 1 Normalized): 75
		Error Rate (SMART Attribute 1 Worst): 64
		Seek Error Rate (SMART Attr 7 Raw): 0x0000000003262081
		Seek Error Rate (SMART Attr 7 Normalized): 77
		Seek Error Rate (SMART Attr 7 Worst): 60
		High Priority Unload Events: 17
		Helium Pressure Threshold Tripped: 0
		LBAs Corrected By Parity Sector: 0
		DVGA Skip Write Detect by Head 0: 0
		DVGA Skip Write Detect by Head 1: 0
		DVGA Skip Write Detect by Head 2: 0
		DVGA Skip Write Detect by Head 3: 0
		DVGA Skip Write Detect by Head 4: 0
		DVGA Skip Write Detect by Head 5: 0
		DVGA Skip Write Detect by Head 6: 0
		DVGA Skip Write Detect by Head 7: 0
		DVGA Skip Write Detect by Head 8: 0
		DVGA Skip Write Detect by Head 9: 0
		RVGA Skip Write Detect by Head 0: 0
		RVGA Skip Write Detect by Head 1: 0
		RVGA Skip Write Detect by Head 2: 0
		RVGA Skip Write Detect by Head 3: 0
		RVGA Skip Write Detect by Head 4: 0
		RVGA Skip Write Detect by Head 5: 0
		RVGA Skip Write Detect by Head 6: 0
		RVGA Skip Write Detect by Head 7: 0
		RVGA Skip Write Detect by Head 8: 0
		RVGA Skip Write Detect by Head 9: 0
		FVGA Skip Write Detect by Head 0: 0
		FVGA Skip Write Detect by Head 1: 0
		FVGA Skip Write Detect by Head 2: 0
		FVGA Skip Write Detect by Head 3: 0
		FVGA Skip Write Detect by Head 4: 0
		FVGA Skip Write Detect by Head 5: 0
		FVGA Skip Write Detect by Head 6: 0
		FVGA Skip Write Detect by Head 7: 0
		FVGA Skip Write Detect by Head 8: 0
		FVGA Skip Write Detect by Head 9: 0
		Skip Write Detect Threshold Exceeded by Head 0: 0
		Skip Write Detect Threshold Exceeded by Head 1: 0
		Skip Write Detect Threshold Exceeded by Head 2: 0
		Skip Write Detect Threshold Exceeded by Head 3: 0
		Skip Write Detect Threshold Exceeded by Head 4: 0
		Skip Write Detect Threshold Exceeded by Head 5: 0
		Skip Write Detect Threshold Exceeded by Head 6: 0
		Skip Write Detect Threshold Exceeded by Head 7: 0
		Skip Write Detect Threshold Exceeded by Head 8: 0
		Skip Write Detect Threshold Exceeded by Head 9: 0
		Write Power On (hrs) by Head 0: 2932
		Write Power On (hrs) by Head 1: 2828
		Write Power On (hrs) by Head 2: 2796
		Write Power On (hrs) by Head 3: 2730
		Write Power On (hrs) by Head 4: 2823
		Write Power On (hrs) by Head 5: 3042
		Write Power On (hrs) by Head 6: 2830
		Write Power On (hrs) by Head 7: 3013
		Write Power On (hrs) by Head 8: 2748
		Write Power On (hrs) by Head 9: 2887
		MR Head Resistance from Head 0: 0
		MR Head Resistance from Head 1: 0
		MR Head Resistance from Head 2: 0
		MR Head Resistance from Head 3: 0
		MR Head Resistance from Head 4: 0
		MR Head Resistance from Head 5: 0
		MR Head Resistance from Head 6: 0
		MR Head Resistance from Head 7: 0
		MR Head Resistance from Head 8: 0
		MR Head Resistance from Head 9: 0
		Second MR Head Resistance by Head 0: 0
		Second MR Head Resistance by Head 1: 0
		Second MR Head Resistance by Head 2: 0
		Second MR Head Resistance by Head 3: 0
		Second MR Head Resistance by Head 4: 0
		Second MR Head Resistance by Head 5: 0
		Second MR Head Resistance by Head 6: 0
		Second MR Head Resistance by Head 7: 0
		Second MR Head Resistance by Head 8: 0
		Second MR Head Resistance by Head 9: 0
		Number of Reallocated Sectors by Head 0: 0
		Number of Reallocated Sectors by Head 1: 0
		Number of Reallocated Sectors by Head 2: 0
		Number of Reallocated Sectors by Head 3: 0
		Number of Reallocated Sectors by Head 4: 0
		Number of Reallocated Sectors by Head 5: 0
		Number of Reallocated Sectors by Head 6: 0
		Number of Reallocated Sectors by Head 7: 0
		Number of Reallocated Sectors by Head 8: 0
		Number of Reallocated Sectors by Head 9: 0
		Number of Reallocation Candidate Sectors by Head 0: 0
		Number of Reallocation Candidate Sectors by Head 1: 0
		Number of Reallocation Candidate Sectors by Head 2: 0
		Number of Reallocation Candidate Sectors by Head 3: 0
		Number of Reallocation Candidate Sectors by Head 4: 0
		Number of Reallocation Candidate Sectors by Head 5: 0
		Number of Reallocation Candidate Sectors by Head 6: 0
		Number of Reallocation Candidate Sectors by Head 7: 0
		Number of Reallocation Candidate Sectors by Head 8: 0
		Number of Reallocation Candidate Sectors by Head 9: 1

